{
  "$schema": "./android-release-identity.schema.json",
  "schemaVersion": 1,
  "checkpoint": "CP26",
  "lastReviewedOn": "2026-07-15",
  "identityStatus": "proposed",
  "brand": {
    "appName": "Grogoni",
    "launcherName": "Grogoni",
    "serviceName": "Grogoni"
  },
  "android": {
    "applicationId": "market.grogoni.app",
    "applicationIdStatus": "proposed",
    "wrapper": "trusted-web-activity",
    "distribution": "google-play",
    "firstTrack": "internal",
    "versionName": "0.1.0",
    "versionCode": 1,
    "minSdk": 23,
    "targetSdk": 35,
    "compileSdk": 35
  },
  "web": {
    "origin": "https://grogoni.com",
    "startUrl": "https://grogoni.com/",
    "scope": "https://grogoni.com/",
    "manifestUrl": "https://grogoni.com/manifest.webmanifest",
    "digitalAssetLinksUrl": "https://grogoni.com/.well-known/assetlinks.json",
    "apiOrigin": "https://grogoni.com"
  },
  "developer": {
    "accountType": "organization",
    "accountTypeStatus": "proposed",
    "playDeveloperName": null,
    "legalEntityName": null,
    "playDeveloperAccountId": null,
    "identityVerificationStatus": "pending"
  },
  "ownership": {
    "releaseOwner": null,
    "playConsolePrimaryOwner": null,
    "uploadKeyCustodian": null,
    "incidentRecoveryOwner": null
  },
  "signing": {
    "playAppSigning": true,
    "privateKeysCommitted": false,
    "uploadCertificateSha256": null,
    "appSigningCertificateSha256": null,
    "rotationAndRecoveryDocumented": false
  },
  "policyBaseline": {
    "targetApiVerifiedOn": "2026-07-15",
    "targetApiSource": "https://developer.android.com/google/play/requirements/target-sdk",
    "revalidateBeforeFirstUpload": true
  },
  "approval": {
    "approvedBy": null,
    "approvedOn": null,
    "changeRecord": null
  }
}
